{"adapter_sha256":"4dc0149fd8626e21bffec1496d946b5ccb094351bc30141e5e0c177ed7349cbc","candidate_id":"minimal-settled-set","candidate_implementation_sha256":"7e450d1725ac0d5f0d43374fa4a8ab0c9c43fe578c651bd1652789b0cebfa775","cases":[{"dimension":"quality","fixture_id":"quality-claim-evidence","output_locator":"compatibility/minimal-settled-set/quality-claim-evidence-output.json","output_sha256":"a6cf61a1ccbedd88feefcb06d261e605777932efd61f8f21bc7ae3ad11f5d518","result":"pass"},{"dimension":"lifecycle","fixture_id":"lifecycle-interruption","output_locator":"compatibility/minimal-settled-set/lifecycle-interruption-output.json","output_sha256":"8dd315087da1bb52b2f3e890cff7cc0a86015fdc05e6ed839e671d63199e46b7","result":"pass"}],"compatibility_payload_sha256":"988cc13155c13ab6975c3983a708d336a6c89f88dbb188861333f585bc4d0d1a","evaluated_at":"2026-07-28T10:04:34Z","fixture_set":"forward-v1","lifecycle_result":"pass","quality_result":"pass","runner":"codex-evaluation-harness","runner_locator":"scripts/adapter_evaluation_scorer.py","runner_sha256":"dfacbc817215d02be2ac20591fb3191dcc8548d9af275dfae7f818016eb81a1f","runner_version":"1.0.0","schema_version":"1.0.0"}
