{"adapter_sha256":"4dc0149fd8626e21bffec1496d946b5ccb094351bc30141e5e0c177ed7349cbc","candidate_id":"persisted-task-registry","candidate_implementation_sha256":"b3c44c7d90892dc65715690c44a14ebfa6220784459e8dedf481358edad1dd31","cases":[{"dimension":"quality","fixture_id":"quality-claim-evidence","output_locator":"compatibility/persisted-task-registry/quality-claim-evidence-output.json","output_sha256":"2d2470249a5f3467785868c45210a1e21303369198e21658556a7ac6a76d2dba","result":"pass"},{"dimension":"lifecycle","fixture_id":"lifecycle-interruption","output_locator":"compatibility/persisted-task-registry/lifecycle-interruption-output.json","output_sha256":"1b9a9bb4580dc2b048f864cb4b0c2329e29e5e2696f491c5767b6b3d4ab4f137","result":"pass"}],"compatibility_payload_sha256":"988cc13155c13ab6975c3983a708d336a6c89f88dbb188861333f585bc4d0d1a","evaluated_at":"2026-07-28T10:04:34Z","fixture_set":"forward-v1","lifecycle_result":"pass","quality_result":"pass","runner":"codex-evaluation-harness","runner_locator":"scripts/adapter_evaluation_scorer.py","runner_sha256":"dfacbc817215d02be2ac20591fb3191dcc8548d9af275dfae7f818016eb81a1f","runner_version":"1.0.0","schema_version":"1.0.0"}
